[
  {
    "id": "AND-0001",
    "date": "1994-06-21",
    "dateEnd": null,
    "datePrecision": "day",
    "tier": "acknowledged",
    "category": ["press"],
    "location": { "place": "Jakarta", "province": "DKI Jakarta" },
    "actor": "Ministry of Information (Minister Harmoko)",
    "title": {
      "en": "Information Ministry revokes the publishing licences of Tempo, Editor and DeTIK",
      "id": "Departemen Penerangan mencabut izin terbit Tempo, Editor, dan DeTIK",
      "nl": "Ministerie van Voorlichting trekt de publicatievergunningen van Tempo, Editor en DeTIK in",
      "de": "Informationsministerium entzieht Tempo, Editor und DeTIK die Publikationslizenz"
    },
    "summary": {
      "en": "On 21 June 1994 Information Minister Harmoko revoked the publishing licences (SIUPP) of the weekly magazines Tempo and Editor and the tabloid DeTIK, as reported by The Jakarta Post and Human Rights Watch. The 1982 Press Law in force at the time allowed licences to be revoked, so this entry measures the act against international standards on freedom of expression.",
      "id": "Pada 21 Juni 1994, Menteri Penerangan Harmoko mencabut Surat Izin Usaha Penerbitan Pers (SIUPP) majalah mingguan Tempo dan Editor serta tabloid DeTIK, seperti diberitakan The Jakarta Post dan Human Rights Watch. UU Pers tahun 1982 yang berlaku saat itu memang membolehkan pencabutan izin, jadi entri ini menilai tindakan tersebut dengan standar internasional tentang kebebasan berekspresi.",
      "nl": "Op 21 juni 1994 trok minister van Voorlichting Harmoko de publicatievergunningen (SIUPP) in van de weekbladen Tempo en Editor en van het tabloid DeTIK, zo berichtten The Jakarta Post en Human Rights Watch. De perswet van 1982 die toen gold stond het intrekken van vergunningen toe, daarom toetst dit item de handeling aan internationale normen voor de vrijheid van meningsuiting.",
      "de": "Am 21. Juni 1994 entzog Informationsminister Harmoko den Wochenmagazinen Tempo und Editor sowie dem Boulevardblatt DeTIK die Publikationslizenz (SIUPP), wie The Jakarta Post und Human Rights Watch berichteten. Das damals geltende Pressegesetz von 1982 erlaubte den Entzug von Lizenzen, deshalb misst dieser Eintrag die Maßnahme an internationalen Standards der Meinungsfreiheit."
    },
    "context": {
      "en": "On 3 May 1995 the Jakarta Administrative Court ruled that the decree revoking Tempo's licence was legally flawed. Human Rights Watch reported that the minister announced an appeal, with the President's endorsement. After Reformasi, Law No. 40 of 1999, Article 4(2), banned the banning of the press outright.",
      "id": "Pada 3 Mei 1995, Pengadilan Tata Usaha Negara Jakarta memutuskan bahwa surat keputusan pencabutan izin Tempo cacat hukum. Menurut Human Rights Watch, menteri kemudian mengumumkan banding dengan restu Presiden. Setelah Reformasi, UU Nomor 40 Tahun 1999 Pasal 4 ayat (2) melarang pembredelan pers sepenuhnya.",
      "nl": "Op 3 mei 1995 oordeelde de bestuursrechter in Jakarta dat het besluit waarmee de vergunning van Tempo was ingetrokken juridisch gebrekkig was. Volgens Human Rights Watch kondigde de minister daarop hoger beroep aan, met steun van de president. Na de Reformasi verbood wet nr. 40 van 1999, artikel 4, lid 2, het verbieden van persorganen volledig.",
      "de": "Am 3. Mai 1995 entschied das Verwaltungsgericht Jakarta, dass der Erlass zum Lizenzentzug für Tempo rechtlich fehlerhaft war. Laut Human Rights Watch kündigte der Minister daraufhin mit Rückendeckung des Präsidenten Berufung an. Nach der Reformasi verbot Gesetz Nr. 40 von 1999, Artikel 4 Absatz 2, das Verbot von Presseorganen vollständig."
    },
    "laws": [{ "law": "udhr-19", "pinpoint": null }],
    "sources": [
      { "title": "Twenty years after 'Tempo' banning reflection", "publisher": "The Jakarta Post", "url": "https://www.thejakartapost.com/news/2014/06/26/twenty-years-after-tempo-banning-reflection", "lang": "en", "published": "2014-06-26", "type": "news" },
      { "title": "Press Closures in Indonesia One Year Later", "publisher": "Human Rights Watch (via Refworld)", "url": "https://www.refworld.org/reference/countryrep/hrw/1995/92590", "lang": "en", "published": "1995-07-01", "type": "ngo" },
      { "title": "25 Years after Banning of Tempo; Media Resist Against Suppression", "publisher": "Tempo English", "url": "https://en.tempo.co/amp/1217150/25-years-after-banning-of-tempo-media-resist-against-suppression", "lang": "en", "published": "2019-06-22", "type": "news" }
    ],
    "intake": "manual",
    "addedOn": "2026-10-29"
  },
  {
    "id": "AND-0002",
    "date": "1994-06-27",
    "dateEnd": null,
    "datePrecision": "day",
    "tier": "documented",
    "category": ["assembly", "expression"],
    "location": { "place": "Jakarta", "province": "DKI Jakarta" },
    "actor": "Indonesian security forces",
    "title": {
      "en": "Protesters against the press bans detained and beaten in Jakarta",
      "id": "Pengunjuk rasa penentang pembredelan pers ditangkap dan dipukuli di Jakarta",
      "nl": "Demonstranten tegen de persverboden opgepakt en geslagen in Jakarta",
      "de": "Demonstrierende gegen die Presseverbote in Jakarta festgenommen und geschlagen"
    },
    "summary": {
      "en": "Amnesty International reported that more than 50 people were detained or badly beaten by Indonesian security forces during a peaceful protest in Jakarta against the bans on Tempo, Editor and DeTIK. They were among some 300 protesters who had tried to march to the Ministry of Information.",
      "id": "Amnesty International melaporkan bahwa lebih dari 50 orang ditangkap atau dipukuli dengan parah oleh aparat keamanan Indonesia dalam aksi damai di Jakarta yang menentang pembredelan Tempo, Editor, dan DeTIK. Mereka termasuk dalam sekitar 300 pengunjuk rasa yang berusaha berjalan menuju Departemen Penerangan.",
      "nl": "Amnesty International meldde dat meer dan 50 mensen door Indonesische veiligheidstroepen werden opgepakt of zwaar mishandeld tijdens een vreedzaam protest in Jakarta tegen het verbod op Tempo, Editor en DeTIK. Zij hoorden bij zo'n 300 demonstranten die naar het ministerie van Voorlichting probeerden te lopen.",
      "de": "Amnesty International berichtete, dass indonesische Sicherheitskräfte bei einem friedlichen Protest in Jakarta gegen das Verbot von Tempo, Editor und DeTIK mehr als 50 Menschen festnahmen oder schwer verprügelten. Sie gehörten zu etwa 300 Demonstrierenden, die zum Informationsministerium ziehen wollten."
    },
    "context": null,
    "laws": [{ "law": "udhr-19", "pinpoint": null }, { "law": "udhr-20", "pinpoint": null }],
    "sources": [
      { "title": "Indonesia: Free speech protesters detained and beaten (ASA 21/027/1994)", "publisher": "Amnesty International", "url": "https://www.amnesty.org/en/documents/asa21/027/1994/en/", "lang": "en", "published": null, "type": "ngo" }
    ],
    "intake": "manual",
    "addedOn": "2026-10-29"
  },
  {
    "id": "AND-0003",
    "date": "2015-11-10",
    "dateEnd": null,
    "datePrecision": "day",
    "tier": "documented",
    "category": ["press"],
    "location": { "place": "Papua and West Papua", "province": "Papua, Papua Barat" },
    "actor": "Central government and National Police (Polri)",
    "title": {
      "en": "Human Rights Watch documents continuing limits on foreign media in Papua",
      "id": "Human Rights Watch mendokumentasikan pembatasan media asing di Papua yang terus berlanjut",
      "nl": "Human Rights Watch documenteert aanhoudende beperkingen voor buitenlandse media in Papoea",
      "de": "Human Rights Watch dokumentiert anhaltende Beschränkungen für ausländische Medien in Papua"
    },
    "summary": {
      "en": "Human Rights Watch's report \"Something to Hide?\" documented that restrictions on foreign journalists and rights monitors in Papua continued despite President Joko Widodo's announcement on 10 May 2015 that they were lifted, including requirements to obtain police permission. A 2017 follow-up by Human Rights Watch found that a government clearing house was still vetting requests from foreign journalists.",
      "id": "Laporan Human Rights Watch berjudul \"Something to Hide?\" mendokumentasikan bahwa pembatasan terhadap jurnalis asing dan pemantau HAM di Papua tetap berlaku, meskipun Presiden Joko Widodo pada 10 Mei 2015 mengumumkan pembatasan itu dicabut, termasuk kewajiban meminta izin polisi. Laporan lanjutan Human Rights Watch pada 2017 menemukan bahwa sebuah tim lintas instansi pemerintah masih menyaring permohonan dari jurnalis asing.",
      "nl": "Het rapport \"Something to Hide?\" van Human Rights Watch documenteerde dat de beperkingen voor buitenlandse journalisten en mensenrechtenwaarnemers in Papoea bleven bestaan, ondanks de aankondiging van president Joko Widodo op 10 mei 2015 dat ze waren opgeheven, waaronder de plicht om toestemming van de politie te vragen. Een vervolgonderzoek van Human Rights Watch uit 2017 stelde vast dat een overheidsloket nog steeds aanvragen van buitenlandse journalisten screende.",
      "de": "Der Bericht \"Something to Hide?\" von Human Rights Watch dokumentierte, dass die Beschränkungen für ausländische Journalisten und Menschenrechtsbeobachter in Papua fortbestanden, obwohl Präsident Joko Widodo am 10. Mai 2015 ihre Aufhebung verkündet hatte, darunter die Pflicht, eine Genehmigung der Polizei einzuholen. Eine Folgeuntersuchung von Human Rights Watch aus dem Jahr 2017 ergab, dass eine staatliche Prüfstelle Anfragen ausländischer Journalisten weiterhin kontrollierte."
    },
    "context": {
      "en": "The entry is dated to the publication of the report. The restrictions it describes began well before 2015.",
      "id": "Tanggal entri ini mengikuti tanggal terbit laporan. Pembatasan yang digambarkan di dalamnya sudah berlangsung jauh sebelum 2015.",
      "nl": "Dit item is gedateerd op de publicatie van het rapport. De beschreven beperkingen bestonden al lang voor 2015.",